add_time,prod_color,prod_id,prod_name,prod_topic,prod_url,rate,rate_score,sale_num
2019-11-07,亮黑,27582429988,新日（Sunra）电动车 折叠电动自行车 新国标代驾成人电瓶车 小型迷你轻便代步车TDSZH-206 锂电池/12AH【约90KM助力续航】珍珠白,新日,https://item.jd.com/27582429988.html,刚装完，还没感受一下，希望不辜负我期望吧,5,863
2019-11-07,珍珠白色,27582429988,新日（Sunra）电动车 折叠电动自行车 新国标代驾成人电瓶车 小型迷你轻便代步车TDSZH-206 锂电池/12AH【约90KM助力续航】珍珠白,新日,https://item.jd.com/27582429988.html,总体比较满意比实体店要便宜大几百速度解锁后25km/h续航估计40+km带人太高太胖的不行没有减震过减速带要慢点,5,863
2019-11-07,珍珠白色,27582429988,新日（Sunra）电动车 折叠电动自行车 新国标代驾成人电瓶车 小型迷你轻便代步车TDSZH-206 锂电池/12AH【约90KM助力续航】珍珠白,新日,https://item.jd.com/27582429988.html,为什么后轮没气，问客服一直没回消息，车确实看起来不错，仅仅只是看起来不错,1,863
2019-11-07,亮黑,27582429988,新日（Sunra）电动车 折叠电动自行车 新国标代驾成人电瓶车 小型迷你轻便代步车TDSZH-206 锂电池/12AH【约90KM助力续航】珍珠白,新日,https://item.jd.com/27582429988.html,1星给车子，刚收到车子具体续航过几天追评，冲着新日大品牌买的，但是客服真让人无语，问什么都是稍等，稍等...呵呵，客服真玩蛋，拿钱不干活早晚滚蛋。最后一张图解除限速,1,863
2019-11-07,珍珠白色,27582429988,新日（Sunra）电动车 折叠电动自行车 新国标代驾成人电瓶车 小型迷你轻便代步车TDSZH-206 锂电池/12AH【约90KM助力续航】珍珠白,新日,https://item.jd.com/27582429988.html,特别慢，快递6天才到，叫什么贝业新兄弟的，车子也特别忙，单车都比不过&hellip;事实,1,863
2019-11-07,亮黑,27582429988,新日（Sunra）电动车 折叠电动自行车 新国标代驾成人电瓶车 小型迷你轻便代步车TDSZH-206 锂电池/12AH【约90KM助力续航】珍珠白,新日,https://item.jd.com/27582429988.html,挺好看的。解除限速后还可以，挺快的～客户评价一般。车可以。,5,863
2019-11-07,珍珠白色,27582429988,新日（Sunra）电动车 折叠电动自行车 新国标代驾成人电瓶车 小型迷你轻便代步车TDSZH-206 锂电池/12AH【约90KM助力续航】珍珠白,新日,https://item.jd.com/27582429988.html,好品质看新日，一直信赖京东，比实体店便宜多，锂电折叠方便好多，好评,5,863
2019-11-07,珍珠白色,27582429988,新日（Sunra）电动车 折叠电动自行车 新国标代驾成人电瓶车 小型迷你轻便代步车TDSZH-206 锂电池/12AH【约90KM助力续航】珍珠白,新日,https://item.jd.com/27582429988.html,小车款式时尚，不折叠能进电梯，略重，一搬推进家里，自从有了它，下午可以到处溜达兜风了。,5,863
2019-11-07,亮黑,27582429988,新日（Sunra）电动车 折叠电动自行车 新国标代驾成人电瓶车 小型迷你轻便代步车TDSZH-206 锂电池/12AH【约90KM助力续航】珍珠白,新日,https://item.jd.com/27582429988.html,新车刚送来电池就没电，推着回家的，充满电去上班，明明10分钟可以到的，硬是骑了半个小时，电动的还没有脚蹬的快！然后电池不牢固，骑起来异响，给客服沟通，客服种种理由不给答复，只好差评了,1,863
2019-11-07,珍珠白色,27582429988,新日（Sunra）电动车 折叠电动自行车 新国标代驾成人电瓶车 小型迷你轻便代步车TDSZH-206 锂电池/12AH【约90KM助力续航】珍珠白,新日,https://item.jd.com/27582429988.html,垃圾新日垃圾服务，买的15Ah收到货是12Ah，投诉电话没人接，,1,863
2019-11-07,亮黑,27582429988,新日（Sunra）电动车 折叠电动自行车 新国标代驾成人电瓶车 小型迷你轻便代步车TDSZH-206 锂电池/12AH【约90KM助力续航】珍珠白,新日,https://item.jd.com/27582429988.html,第一辆新日电动车骑了八年退休，希望这辆能保持,5,863
2019-11-07,亮黑,27582429988,新日（Sunra）电动车 折叠电动自行车 新国标代驾成人电瓶车 小型迷你轻便代步车TDSZH-206 锂电池/12AH【约90KM助力续航】珍珠白,新日,https://item.jd.com/27582429988.html,超级喜欢，质量好，,5,863
2019-11-07,珍珠白色,27582429988,新日（Sunra）电动车 折叠电动自行车 新国标代驾成人电瓶车 小型迷你轻便代步车TDSZH-206 锂电池/12AH【约90KM助力续航】珍珠白,新日,https://item.jd.com/27582429988.html,电动车不错，白色很漂亮，目前没有啥问题，值得购买，防盗系统有待提高，整体来说很好?,5,863
2019-11-07,珍珠白色,27582429988,新日（Sunra）电动车 折叠电动自行车 新国标代驾成人电瓶车 小型迷你轻便代步车TDSZH-206 锂电池/12AH【约90KM助力续航】珍珠白,新日,https://item.jd.com/27582429988.html,很不错，小巧但动力足，很漂亮。,5,863
2019-11-07,亮黑,27582429988,新日（Sunra）电动车 折叠电动自行车 新国标代驾成人电瓶车 小型迷你轻便代步车TDSZH-206 锂电池/12AH【约90KM助力续航】珍珠白,新日,https://item.jd.com/27582429988.html,客服服务态度好有耐心其余的都挺好的,5,863
2019-11-07,珍珠白色,27582429988,新日（Sunra）电动车 折叠电动自行车 新国标代驾成人电瓶车 小型迷你轻便代步车TDSZH-206 锂电池/12AH【约90KM助力续航】珍珠白,新日,https://item.jd.com/27582429988.html,非常漂亮的小车，代步完全够用，虽然到手有一些小问题，希望官方持续完善，总体评价不错！,5,863
2019-11-07,亮黑,27582429988,新日（Sunra）电动车 折叠电动自行车 新国标代驾成人电瓶车 小型迷你轻便代步车TDSZH-206 锂电池/12AH【约90KM助力续航】珍珠白,新日,https://item.jd.com/27582429988.html,一颗星是给客服的！车子到货充满电无法启动申请退货说要承担400+运费，要么就维修！售后拉走检测【没人跟去】拉回来回复是电池没激活！而且油漆喷的也不均匀车座是破的。最重要的一点不是自营店。是第三方！！！车锁也不是随车送需要评论,1,863
2019-11-07,亮黑,27582429988,新日（Sunra）电动车 折叠电动自行车 新国标代驾成人电瓶车 小型迷你轻便代步车TDSZH-206 锂电池/12AH【约90KM助力续航】珍珠白,新日,https://item.jd.com/27582429988.html,车子收到了外观精致小巧还没有骑应该不错,5,863
2019-11-07,珍珠白色,27582429988,新日（Sunra）电动车 折叠电动自行车 新国标代驾成人电瓶车 小型迷你轻便代步车TDSZH-206 锂电池/12AH【约90KM助力续航】珍珠白,新日,https://item.jd.com/27582429988.html,收到车了，物流挺快的，试骑了一下，暂时没有发现问题。车子挺好看的，我买的白色的，不错。,5,863
2019-11-07,锂电池/12AH【约90KM助力续航】哑光摩力黑,27582429988,新日（Sunra）电动车 折叠电动自行车 新国标代驾成人电瓶车 小型迷你轻便代步车TDSZH-206 锂电池/12AH【约90KM助力续航】珍珠白,新日,https://item.jd.com/27582429988.html,车子质量：很好，女生搬后备箱吃力，折叠方便外形外观：大气，很漂亮，适用场景：短途上下班骑行体验：代步足够用了电池续航：还没正式开始骑,5,863
2019-11-07,锂电池/14AH【约110KM助力续航】珍珠白,27582429988,新日（Sunra）电动车 折叠电动自行车 新国标代驾成人电瓶车 小型迷你轻便代步车TDSZH-206 锂电池/12AH【约90KM助力续航】珍珠白,新日,https://item.jd.com/27582429988.html,大品牌，质量好，主要是电池可以提出来，回家里充电，很方便的。,5,863
2019-11-07,【约110KM助力续航】珍珠白,27582429988,新日（Sunra）电动车 折叠电动自行车 新国标代驾成人电瓶车 小型迷你轻便代步车TDSZH-206 锂电池/12AH【约90KM助力续航】珍珠白,新日,https://item.jd.com/27582429988.html,老牌子标准规范还是有的页宣传跟一致更好的呢,2,863
2019-11-07,亮黑,27582429988,新日（Sunra）电动车 折叠电动自行车 新国标代驾成人电瓶车 小型迷你轻便代步车TDSZH-206 锂电池/12AH【约90KM助力续航】珍珠白,新日,https://item.jd.com/27582429988.html,很好很好很好很好很好很好很好很好很好很好,5,863
2019-11-07,亮黑,27582429988,新日（Sunra）电动车 折叠电动自行车 新国标代驾成人电瓶车 小型迷你轻便代步车TDSZH-206 锂电池/12AH【约90KM助力续航】珍珠白,新日,https://item.jd.com/27582429988.html,车子看起来很精致质量也很好，原来以为车灯安装不对，开灯后冲着天上的，后来一看是可以自己调的，设计很好,5,863
