add_time,prod_color,prod_id,prod_name,prod_topic,prod_url,rate,rate_score,sale_num
2019-11-07,黑色,29815922453,小牛（XIAONIU） 小牛电动车U PRO顶配套装 智能锂电电动踏板车 电动代步自行 黑色 新国标安全版,小牛,https://item.jd.com/29815922453.html,这么大的雨给顺丰小哥手动点赞。。。黑红真的太帅啦,5,433
2019-11-07,黑色,29815922453,小牛（XIAONIU） 小牛电动车U PRO顶配套装 智能锂电电动踏板车 电动代步自行 黑色 新国标安全版,小牛,https://item.jd.com/29815922453.html,新鲜出炉，过两天骑车看看，希望不要让我失望,5,433
2019-11-07,黑色,29815922453,小牛（XIAONIU） 小牛电动车U PRO顶配套装 智能锂电电动踏板车 电动代步自行 黑色 新国标安全版,小牛,https://item.jd.com/29815922453.html,早上查，预计下午4点送达，中午看变成晚上9点半。本以为今天收不到了，15.20就到达了~兴奋~载人套件已经装在车上了，回家路上可以带个顺风车?双油刹壶是透明的，可以清楚看到是否需要保养刹车油。,5,433
2019-11-07,黑色,29815922453,小牛（XIAONIU） 小牛电动车U PRO顶配套装 智能锂电电动踏板车 电动代步自行 黑色 新国标安全版,小牛,https://item.jd.com/29815922453.html,刚收到先用着,5,433
2019-11-07,黑色,29815922453,小牛（XIAONIU） 小牛电动车U PRO顶配套装 智能锂电电动踏板车 电动代步自行 黑色 新国标安全版,小牛,https://item.jd.com/29815922453.html,想买的自己看啊，刚拆包的，热乎着呢?！,5,433
2019-11-07,黑色,29815922453,小牛（XIAONIU） 小牛电动车U PRO顶配套装 智能锂电电动踏板车 电动代步自行 黑色 新国标安全版,小牛,https://item.jd.com/29815922453.html,收到啦收到啦，激动的我还请假打车回家接她，非常好，动力很足，外观好看，没有想到赠品还挺多的，挺不错的，骑车舒服，APP很好用，牛油宝也是已经激活了！希望小牛越来越好！,5,433
2019-11-07,黑色,29815922453,小牛（XIAONIU） 小牛电动车U PRO顶配套装 智能锂电电动踏板车 电动代步自行 黑色 新国标安全版,小牛,https://item.jd.com/29815922453.html,超棒的，好喜欢，安装到位，静等发票，上牌照,5,433
2019-11-07,黑色,29815922453,小牛（XIAONIU） 小牛电动车U PRO顶配套装 智能锂电电动踏板车 电动代步自行 黑色 新国标安全版,小牛,https://item.jd.com/29815922453.html,开着很舒服造型也很好看虽说有点小贵但感觉很值,5,433
2019-11-07,黑色,29815922453,小牛（XIAONIU） 小牛电动车U PRO顶配套装 智能锂电电动踏板车 电动代步自行 黑色 新国标安全版,小牛,https://item.jd.com/29815922453.html,关注小牛很长时间了，尤其是全国整顿电摩，***目录上榜后，价格一直居高不下，想想u1pro版的价格与n1价格差不多了，故迟迟未下手，谁料原使用的旧电动车锂电池衰减厉害，如果单购一块新锂电又得上千元，加上早就有换车的打算，索性一步到位，换个可心的小牛u1pro吧。11月1日促销活动下单，10月3日一大早7点日日顺物流送到楼下，开箱简单验货，0公里新车，电池1个循环，车身有轻微划痕，塑料装饰件有变形问题，焊接质量不高，希望小牛质检部门加强品控。看网上很多牛油反应u1后尾灯开裂，据说是因为后部框架钢板强度不够，不知道现在的新车解决了没有，但愿别遇到此问题。总的来说小牛从车辆本身到售前售后的服务还是让人满意的，一分钱一分货，质价相符吧。在此特别表扬售后牛嘉莉妹子，对待用户如家人，遇到的问题也是积极解决，有问有答，希望把这种热情周到的工作态度一如既往的坚持下去，也真心希望小牛越来越好。给了好评！,5,433
2019-11-07,黑色,29815922453,小牛（XIAONIU） 小牛电动车U PRO顶配套装 智能锂电电动踏板车 电动代步自行 黑色 新国标安全版,小牛,https://item.jd.com/29815922453.html,单人骑行很方便，不破解确实慢了一点，刚刚可以挤进电梯，1号买的，2号下午就收到了，速度棒棒的,5,433
2019-11-07,黑色,29815922453,小牛（XIAONIU） 小牛电动车U PRO顶配套装 智能锂电电动踏板车 电动代步自行 黑色 新国标安全版,小牛,https://item.jd.com/29815922453.html,还可以吧，就是价格有点贵。实际里程也没有那么多。我买的顶配版，预估是80公里，实际也就60多公里。客服服务很垃圾。,3,433
2019-11-07,黑色,29815922453,小牛（XIAONIU） 小牛电动车U PRO顶配套装 智能锂电电动踏板车 电动代步自行 黑色 新国标安全版,小牛,https://item.jd.com/29815922453.html,挺好～感觉高大上～,5,433
2019-11-07,黑色,29815922453,小牛（XIAONIU） 小牛电动车U PRO顶配套装 智能锂电电动踏板车 电动代步自行 黑色 新国标安全版,小牛,https://item.jd.com/29815922453.html,第二辆了，不错很好,5,433
2019-11-07,黑色,29815922453,小牛（XIAONIU） 小牛电动车U PRO顶配套装 智能锂电电动踏板车 电动代步自行 黑色 新国标安全版,小牛,https://item.jd.com/29815922453.html,帅气的小牛u1，太棒了，就喜欢他的简洁大方,5,433
2019-11-07,黑色,29815922453,小牛（XIAONIU） 小牛电动车U PRO顶配套装 智能锂电电动踏板车 电动代步自行 黑色 新国标安全版,小牛,https://item.jd.com/29815922453.html,终于有了自己的小电牛啦！！！后碟刹！充满机械力量的车身！虽然物流中有小划伤&hellip;&hellip;晚上&ldquo;溜牛&rdquo;去了！,5,433
2019-11-07,黑色,29815922453,小牛（XIAONIU） 小牛电动车U PRO顶配套装 智能锂电电动踏板车 电动代步自行 黑色 新国标安全版,小牛,https://item.jd.com/29815922453.html,车辆完好，顺丰服务好,5,433
